{
  "name": "nine-way-convergence",
  "seed": 9,
  "peers": [
    {"name": "lazily-rs", "peer_id": 1},
    {"name": "lazily-zig", "peer_id": 2},
    {"name": "lazily-py", "peer_id": 3},
    {"name": "lazily-kt", "peer_id": 4},
    {"name": "lazily-js", "peer_id": 5},
    {"name": "lazily-dart", "peer_id": 6},
    {"name": "lazily-go", "peer_id": 7},
    {"name": "lazily-cpp", "peer_id": 8},
    {"name": "lazily-cs", "peer_id": 9}
  ],
  "required_features": ["distributed_crdt"],
  "required_codecs": [],
  "required_channels": [],
  "steps": [
    {"op": "local_set", "peer": "lazily-rs", "node": 7, "key": null, "state": {"Inline": [65]}, "at": 10, "save_as": "rs-write"},
    {"op": "local_set", "peer": "lazily-zig", "node": 7, "key": null, "state": {"Inline": [66]}, "at": 10, "save_as": "zig-write"},
    {"op": "local_set", "peer": "lazily-py", "node": 7, "key": null, "state": {"Inline": [67]}, "at": 10, "save_as": "py-write"},
    {"op": "local_set", "peer": "lazily-kt", "node": 7, "key": null, "state": {"Inline": [68]}, "at": 10, "save_as": "kt-write"},
    {"op": "local_set", "peer": "lazily-js", "node": 7, "key": null, "state": {"Inline": [69]}, "at": 20, "save_as": "js-write"},
    {"op": "local_set", "peer": "lazily-dart", "node": 7, "key": null, "state": {"Inline": [70]}, "at": 30, "save_as": "dart-write"},
    {"op": "local_set", "peer": "lazily-go", "node": 7, "key": null, "state": {"Inline": [71]}, "at": 40, "save_as": "go-write"},
    {"op": "local_set", "peer": "lazily-cpp", "node": 7, "key": null, "state": {"Inline": [72]}, "at": 50, "save_as": "cpp-write"},
    {"op": "local_set", "peer": "lazily-cs", "node": 7, "key": null, "state": {"Inline": [73]}, "at": 60, "save_as": "cs-write"},
    {"op": "deliver", "frame": "cs-write", "to": ["lazily-rs", "lazily-zig", "lazily-py", "lazily-kt", "lazily-js", "lazily-dart", "lazily-go", "lazily-cpp"], "at": 61, "expect_applied": 1},
    {"op": "deliver", "frame": "rs-write", "to": ["lazily-cs"], "at": 61, "expect_applied": 1},
    {"op": "deliver", "frame": "zig-write", "to": ["lazily-cs"], "at": 61, "expect_applied": 1},
    {"op": "deliver", "frame": "go-write", "to": ["lazily-cs"], "at": 61, "expect_applied": 1},
    {"op": "deliver", "frame": "cs-write", "to": ["lazily-rs"], "at": 62, "expect_applied": 0},
    {"op": "assert_converged"}
  ],
  "expected_snapshot": [
    {"node": 7, "key": null, "state": {"Inline": [73]}}
  ]
}
