{
  "name": "six-way-convergence",
  "seed": 6,
  "peers": [
    {"name": "lazily-rs", "peer_id": 1},
    {"name": "lazily-zig", "peer_id": 2},
    {"name": "lazily-py", "peer_id": 3},
    {"name": "lazily-kt", "peer_id": 4},
    {"name": "lazily-js", "peer_id": 5},
    {"name": "lazily-dart", "peer_id": 6}
  ],
  "required_features": ["distributed_crdt"],
  "required_codecs": ["json"],
  "required_channels": [],
  "steps": [
    {"op": "local_set", "peer": "lazily-rs", "node": 7, "key": null, "state": {"Inline": [65]}, "at": 10, "save_as": "rs-write"},
    {"op": "local_set", "peer": "lazily-zig", "node": 7, "key": null, "state": {"Inline": [66]}, "at": 10, "save_as": "zig-write"},
    {"op": "local_set", "peer": "lazily-py", "node": 7, "key": null, "state": {"Inline": [67]}, "at": 10, "save_as": "py-write"},
    {"op": "local_set", "peer": "lazily-kt", "node": 7, "key": null, "state": {"Inline": [68]}, "at": 10, "save_as": "kt-write"},
    {"op": "local_set", "peer": "lazily-js", "node": 7, "key": null, "state": {"Inline": [69]}, "at": 20, "save_as": "js-write"},
    {"op": "local_set", "peer": "lazily-dart", "node": 7, "key": null, "state": {"Inline": [70]}, "at": 30, "save_as": "dart-write"},
    {"op": "deliver", "frame": "dart-write", "to": ["lazily-rs", "lazily-zig", "lazily-py", "lazily-kt", "lazily-js"], "at": 31, "expect_applied": 1},
    {"op": "deliver", "frame": "rs-write", "to": ["lazily-dart"], "at": 31, "expect_applied": 1},
    {"op": "deliver", "frame": "zig-write", "to": ["lazily-dart"], "at": 31, "expect_applied": 1},
    {"op": "deliver", "frame": "dart-write", "to": ["lazily-rs"], "at": 32, "expect_applied": 0},
    {"op": "assert_converged"}
  ],
  "expected_snapshot": [
    {"node": 7, "key": null, "state": {"Inline": [70]}}
  ]
}
